{
  "$schema": "https://shiftcut.verblike.com/schema/registry-item.json",
  "name": "code-snippet-apple-terminal-clear-dark",
  "type": "shiftcut:block",
  "title": "Code Snippet - Apple Terminal Clear Dark",
  "description": "Apple Terminal Clear Dark profile: semi-transparent dark background, per-character typing animation of a shell session.",
  "tags": ["code", "developer", "showcase", "terminal", "apple", "apple-terminal"],
  "dimensions": {
    "width": 1920,
    "height": 1080
  },
  "duration": 12,
  "files": [
    {
      "path": "code-snippet-apple-terminal-clear-dark.html",
      "target": "compositions/code-snippet-apple-terminal-clear-dark.html",
      "type": "shiftcut:composition"
    }
  ],
  "preview": {
    "video": "https://static.heygen.ai/shiftcut-oss/docs/images/catalog/blocks/code-snippet-apple-terminal-clear-dark.mp4",
    "poster": "https://static.heygen.ai/shiftcut-oss/docs/images/catalog/blocks/code-snippet-apple-terminal-clear-dark.png"
  }
}
