{
  "$schema": "https://shiftcut.verblike.com/schema/registry-item.json",
  "name": "decision-tree",
  "type": "shiftcut:example",
  "title": "Decision Tree",
  "description": "Animated flowchart with branching paths",
  "dimensions": {
    "width": 1920,
    "height": 1080
  },
  "duration": 15,
  "files": [
    {
      "path": "compositions/decision_tree.html",
      "target": "compositions/decision_tree.html",
      "type": "shiftcut:composition"
    },
    {
      "path": "index.html",
      "target": "index.html",
      "type": "shiftcut:composition"
    }
  ]
}
