{
  "$schema": "https://shiftcut.verblike.com/schema/registry-item.json",
  "name": "code-snippet-apple-terminal-solid-colors",
  "type": "shiftcut:block",
  "title": "Code Snippet - Apple Terminal Solid Colors",
  "description": "Apple Terminal Solid Colors profile: deep purple background with white text, per-character typing animation of a shell session.",
  "tags": ["code", "developer", "showcase", "terminal", "apple", "apple-terminal"],
  "dimensions": {
    "width": 1920,
    "height": 1080
  },
  "duration": 12,
  "files": [
    {
      "path": "code-snippet-apple-terminal-solid-colors.html",
      "target": "compositions/code-snippet-apple-terminal-solid-colors.html",
      "type": "shiftcut:composition"
    }
  ],
  "preview": {
    "video": "https://static.heygen.ai/shiftcut-oss/docs/images/catalog/blocks/code-snippet-apple-terminal-solid-colors.mp4",
    "poster": "https://static.heygen.ai/shiftcut-oss/docs/images/catalog/blocks/code-snippet-apple-terminal-solid-colors.png"
  }
}
