{
  "$schema": "https://shiftcut.verblike.com/schema/registry-item.json",
  "name": "lt-mask-reveal",
  "type": "shiftcut:block",
  "title": "Lower Third — Mask Reveal",
  "description": "Cardless lower third: an accent sweep crosses and clip-path-reveals a heavy name, role fades up; for footage",
  "tags": ["lower-third", "overlay", "podcast", "interview", "bold"],
  "dimensions": { "width": 1920, "height": 1080 },
  "duration": 4.8,
  "files": [
    {
      "path": "lt-mask-reveal.html",
      "target": "compositions/lt-mask-reveal.html",
      "type": "shiftcut:composition"
    }
  ]
}
