{
  "$schema": "https://shiftcut.verblike.com/schema/registry-item.json",
  "name": "cross-warp-morph",
  "type": "shiftcut:block",
  "title": "Cross Warp Morph",
  "description": "Shader transition with cross-warped morphing",
  "tags": ["transition", "shader"],
  "dimensions": {
    "width": 1920,
    "height": 1080
  },
  "duration": 4,
  "files": [
    {
      "path": "cross-warp-morph.html",
      "target": "compositions/cross-warp-morph.html",
      "type": "shiftcut:composition"
    }
  ],
  "preview": {
    "video": "https://static.heygen.ai/shiftcut-oss/docs/images/catalog/blocks/cross-warp-morph.mp4",
    "poster": "https://static.heygen.ai/shiftcut-oss/docs/images/catalog/blocks/cross-warp-morph.png"
  }
}
