{
  "$schema": "https://shiftcut.verblike.com/schema/registry-item.json",
  "name": "yt-lower-third",
  "type": "shiftcut:block",
  "title": "YouTube Lower Third",
  "description": "Animated YouTube subscribe lower third with avatar and channel info",
  "tags": ["social", "overlay", "youtube"],
  "dimensions": {
    "width": 1920,
    "height": 1080
  },
  "duration": 4.5,
  "files": [
    {
      "path": "yt-lower-third.html",
      "target": "compositions/yt-lower-third.html",
      "type": "shiftcut:composition"
    },
    {
      "path": "assets/avatar.jpg",
      "target": "assets/avatar.jpg",
      "type": "shiftcut:asset"
    }
  ],
  "preview": {
    "video": "https://static.heygen.ai/shiftcut-oss/docs/images/catalog/blocks/yt-lower-third.mp4",
    "poster": "https://static.heygen.ai/shiftcut-oss/docs/images/catalog/blocks/yt-lower-third.png"
  }
}
