{
  "$schema": "https://shiftcut.verblike.com/schema/registry-item.json",
  "name": "light-leak",
  "type": "shiftcut:block",
  "title": "Light Leak",
  "description": "Shader transition with cinematic light leak overlay",
  "tags": ["transition", "shader"],
  "dimensions": {
    "width": 1920,
    "height": 1080
  },
  "duration": 4,
  "files": [
    {
      "path": "light-leak.html",
      "target": "compositions/light-leak.html",
      "type": "shiftcut:composition"
    }
  ],
  "preview": {
    "video": "https://static.heygen.ai/shiftcut-oss/docs/images/catalog/blocks/light-leak.mp4",
    "poster": "https://static.heygen.ai/shiftcut-oss/docs/images/catalog/blocks/light-leak.png"
  }
}
