{
  "$schema": "https://shiftcut.verblike.com/schema/registry-item.json",
  "name": "ripple-waves",
  "type": "shiftcut:block",
  "title": "Ripple Waves",
  "description": "Shader transition with concentric ripple wave distortion",
  "tags": ["transition", "shader"],
  "dimensions": {
    "width": 1920,
    "height": 1080
  },
  "duration": 4,
  "files": [
    {
      "path": "ripple-waves.html",
      "target": "compositions/ripple-waves.html",
      "type": "shiftcut:composition"
    }
  ],
  "preview": {
    "video": "https://static.heygen.ai/shiftcut-oss/docs/images/catalog/blocks/ripple-waves.mp4",
    "poster": "https://static.heygen.ai/shiftcut-oss/docs/images/catalog/blocks/ripple-waves.png"
  }
}
