{
  "$schema": "https://shiftcut.verblike.com/schema/registry-item.json",
  "name": "flowchart-vertical",
  "type": "shiftcut:block",
  "title": "Flowchart Vertical",
  "description": "Portrait animated decision tree with SVG connectors, sticky-note nodes, cursor interaction, and typing correction",
  "tags": ["diagram", "flowchart", "interactive", "portrait"],
  "dimensions": {
    "width": 1440,
    "height": 2560
  },
  "duration": 12,
  "files": [
    {
      "path": "flowchart-vertical.html",
      "target": "compositions/flowchart-vertical.html",
      "type": "shiftcut:composition"
    }
  ],
  "preview": {
    "video": "https://static.heygen.ai/shiftcut-oss/docs/images/catalog/blocks/flowchart-vertical.mp4",
    "poster": "https://static.heygen.ai/shiftcut-oss/docs/images/catalog/blocks/flowchart-vertical.png"
  }
}
