{
  "$schema": "https://shiftcut.verblike.com/schema/registry-item.json",
  "name": "reddit-post",
  "type": "shiftcut:block",
  "title": "Reddit Post Card",
  "description": "Animated Reddit post card overlay with upvotes and comments",
  "tags": ["social", "overlay", "reddit"],
  "dimensions": {
    "width": 1920,
    "height": 1080
  },
  "duration": 5,
  "files": [
    {
      "path": "reddit-post.html",
      "target": "compositions/reddit-post.html",
      "type": "shiftcut:composition"
    }
  ],
  "preview": {
    "video": "https://static.heygen.ai/shiftcut-oss/docs/images/catalog/blocks/reddit-post.mp4",
    "poster": "https://static.heygen.ai/shiftcut-oss/docs/images/catalog/blocks/reddit-post.png"
  }
}
