{
  "$schema": "https://shiftcut.verblike.com/schema/registry-item.json",
  "name": "spain-map",
  "type": "shiftcut:block",
  "title": "Spain Map",
  "description": "Animated Spain choropleth by autonomous community with staggered reveals and gradient legend — D3 conic conformal projection",
  "tags": ["data", "map", "geography", "spain", "europe", "choropleth"],
  "dimensions": {
    "width": 1920,
    "height": 1080
  },
  "duration": 12,
  "files": [
    {
      "path": "spain-map.html",
      "target": "compositions/spain-map.html",
      "type": "shiftcut:composition"
    }
  ],
  "preview": {
    "video": "https://static.heygen.ai/shiftcut-oss/docs/images/catalog/blocks/spain-map.mp4",
    "poster": "https://static.heygen.ai/shiftcut-oss/docs/images/catalog/blocks/spain-map.png"
  }
}
